{
  "version": 1,
  "name": "body-file-html",
  "variables": {
    "shipName": {
      "type": "string",
      "default": "U.S.S. Voyager"
    },
    "shipClass": {
      "type": "string",
      "default": "Intrepid-Klasse"
    }
  },
  "routes": [
    {
      "id": "body-file-html-route",
      "request": {
        "method": "GET",
        "path": "/test.html"
      },
      "response": {
        "statusCode": 200,
        "headers": {
          "Content-Type": "text/html"
        },
        "bodyFile": "html/test1.html"
      },
      "times": {
        "unlimited": true
      }
    }
  ]
}
